{"config_hash":"aaaaaaaaaaaaaaaaaaaaaaaaaaaaaaaaaaaaaaaaaaaaaaaaaaaaaaaaaaaaaaaa","end_s":60.0,"features":{"blink_duration":{"quality":1.0,"reason":"no_complete_blink_events","status":"unknown","unit":"s","value":null},"blink_rate":{"quality":1.0,"reason":null,"status":"measured","unit":"events/min","value":0.0},"gaze_direction":{"quality":0.0,"reason":"gaze_backend_unavailable_or_missing_iris","status":"unknown","unit":"normalized_xy","value":null},"perclos":{"quality":1.0,"reason":null,"status":"measured","unit":"fraction","value":0.1},"yawn_duration":{"quality":1.0,"reason":"no_complete_yawn_candidate_events","status":"unknown","unit":"s","value":null},"yawn_rate":{"quality":1.0,"reason":null,"status":"proxy","unit":"events/min","value":0.0}},"schema_version":"1.0.0","session_id":"synthetic","start_s":0.0,"warmup":false}
